{
  "id": "goal_multi_file_artifact",
  "summary": "Return a deterministic multi-file artifact bundle.",
  "prompt": "Return a JSON artifact with format json. The content must be an object with fields {\"kind\": \"multi-file\", \"files\": [...]} and exactly three files sorted lexicographically by path. Use these exact file entries: README.md with content \"# Multi-file Fixture\\n\", src/app.py with content \"print(\\\"hello\\\")\\n\", and src/utils/helpers.py with content \"def add(a, b):\\n    return a + b\\n\". Do not include extra fields.",
  "version": "cA-1.0-pro",
  "tags": [
    "phase3",
    "structural",
    "multi_file"
  ],
  "metadata": {
    "contract_version": "fixture-contract-1.0",
    "model_version": "cA-1.0-pro",
    "policy_pack_id": "cA-pro",
    "policy_pack_version": "1.0",
    "profile_id": "default",
    "profile_version": null,
    "device": null,
    "fixture_id": "multi_file_artifact",
    "scenario_type": "multi_file_artifact",
    "expected_outcome": "pass"
  }
}
