{
  "id": "goal_unsorted_output",
  "summary": "Return a bundle with files in unsorted order.",
  "prompt": "Return a JSON artifact with format json. The content must be {\"kind\": \"multi-file\", \"files\": [...]}. Include two entries in the listed order: src/zeta.txt with content \"zeta\\n\" followed by src/alpha.txt with content \"alpha\\n\". Do not include extra fields.",
  "version": "cA-1.0-pro",
  "tags": [
    "phase3",
    "structural",
    "failure",
    "unsorted"
  ],
  "metadata": {
    "contract_version": "fixture-contract-1.1",
    "model_version": "cA-1.0-pro",
    "policy_pack_id": "cA-pro",
    "policy_pack_version": "1.0",
    "profile_id": "default",
    "profile_version": null,
    "device": null,
    "fixture_id": "unsorted_output",
    "scenario_type": "validator_failure",
    "expected_outcome": "fail"
  }
}
